No.     Time        Source                Destination           Protocol Length Info
      1 0.000000    192.168.1.105         172.168.10.1          UDP      59     Source port: 54160  Destination port: iua

Frame 1: 59 bytes on wire (472 bits), 59 bytes captured (472 bits)
Ethernet II, Src: HonHaiPr_4c:c2:96 (00:23:4d:4c:c2:96), Dst: Netgear_c3:10:10 (00:1f:33:c3:10:10)
Internet Protocol Version 4, Src: 192.168.1.105 (192.168.1.105), Dst: 172.168.10.1 (172.168.10.1)
User Datagram Protocol, Src Port: 54160 (54160), Dst Port: iua (9900)
Data (17 bytes)

0000  6b 65 65 70 20 61 6c 69 76 65 20 70 61 63 6b 65   keep alive packe
0010  74                                                t

No.     Time        Source                Destination           Protocol Length Info
      2 0.514756    192.168.1.105         172.168.10.1          UDP      59     Source port: 54160  Destination port: iua

Frame 2: 59 bytes on wire (472 bits), 59 bytes captured (472 bits)
Ethernet II, Src: HonHaiPr_4c:c2:96 (00:23:4d:4c:c2:96), Dst: Netgear_c3:10:10 (00:1f:33:c3:10:10)
Internet Protocol Version 4, Src: 192.168.1.105 (192.168.1.105), Dst: 172.168.10.1 (172.168.10.1)
User Datagram Protocol, Src Port: 54160 (54160), Dst Port: iua (9900)
Data (17 bytes)

0000  6b 65 65 70 20 61 6c 69 76 65 20 70 61 63 6b 65   keep alive packe
0010  74                                                t

No.     Time        Source                Destination           Protocol Length Info
      3 1.029627    192.168.1.105         172.168.10.1          UDP      59     Source port: 54160  Destination port: iua

Frame 3: 59 bytes on wire (472 bits), 59 bytes captured (472 bits)
Ethernet II, Src: HonHaiPr_4c:c2:96 (00:23:4d:4c:c2:96), Dst: Netgear_c3:10:10 (00:1f:33:c3:10:10)
Internet Protocol Version 4, Src: 192.168.1.105 (192.168.1.105), Dst: 172.168.10.1 (172.168.10.1)
User Datagram Protocol, Src Port: 54160 (54160), Dst Port: iua (9900)
Data (17 bytes)

0000  6b 65 65 70 20 61 6c 69 76 65 20 70 61 63 6b 65   keep alive packe
0010  74                                                t

No.     Time        Source                Destination           Protocol Length Info
      4 1.544478    192.168.1.105         172.168.10.1          UDP      59     Source port: 54160  Destination port: iua

Frame 4: 59 bytes on wire (472 bits), 59 bytes captured (472 bits)
Ethernet II, Src: HonHaiPr_4c:c2:96 (00:23:4d:4c:c2:96), Dst: Netgear_c3:10:10 (00:1f:33:c3:10:10)
Internet Protocol Version 4, Src: 192.168.1.105 (192.168.1.105), Dst: 172.168.10.1 (172.168.10.1)
User Datagram Protocol, Src Port: 54160 (54160), Dst Port: iua (9900)
Data (17 bytes)

0000  6b 65 65 70 20 61 6c 69 76 65 20 70 61 63 6b 65   keep alive packe
0010  74                                                t

No.     Time        Source                Destination           Protocol Length Info
      5 2.059181    192.168.1.105         69.171.228.12         TCP      54     nati-svrloc > http [RST, ACK] Seq=1 Ack=1 Win=0 Len=0

Frame 5: 54 bytes on wire (432 bits), 54 bytes captured (432 bits)
Ethernet II, Src: HonHaiPr_4c:c2:96 (00:23:4d:4c:c2:96), Dst: Netgear_c3:10:10 (00:1f:33:c3:10:10)
Internet Protocol Version 4, Src: 192.168.1.105 (192.168.1.105), Dst: 69.171.228.12 (69.171.228.12)
Transmission Control Protocol, Src Port: nati-svrloc (3580), Dst Port: http (80), Seq: 1, Ack: 1, Len: 0

No.     Time        Source                Destination           Protocol Length Info
      6 2.059413    192.168.1.105         23.48.151.55          TCP      54     ms-la > http [RST, ACK] Seq=1 Ack=1 Win=0 Len=0

Frame 6: 54 bytes on wire (432 bits), 54 bytes captured (432 bits)
Ethernet II, Src: HonHaiPr_4c:c2:96 (00:23:4d:4c:c2:96), Dst: Netgear_c3:10:10 (00:1f:33:c3:10:10)
Internet Protocol Version 4, Src: 192.168.1.105 (192.168.1.105), Dst: 23.48.151.55 (23.48.151.55)
Transmission Control Protocol, Src Port: ms-la (3535), Dst Port: http (80), Seq: 1, Ack: 1, Len: 0

No.     Time        Source                Destination           Protocol Length Info
      7 2.059695    192.168.1.105         172.168.10.1          UDP      59     Source port: 54160  Destination port: iua

Frame 7: 59 bytes on wire (472 bits), 59 bytes captured (472 bits)
Ethernet II, Src: HonHaiPr_4c:c2:96 (00:23:4d:4c:c2:96), Dst: Netgear_c3:10:10 (00:1f:33:c3:10:10)
Internet Protocol Version 4, Src: 192.168.1.105 (192.168.1.105), Dst: 172.168.10.1 (172.168.10.1)
User Datagram Protocol, Src Port: 54160 (54160), Dst Port: iua (9900)
Data (17 bytes)

0000  6b 65 65 70 20 61 6c 69 76 65 20 70 61 63 6b 65   keep alive packe
0010  74                                                t

No.     Time        Source                Destination           Protocol Length Info
      8 2.574149    192.168.1.105         172.168.10.1          UDP      59     Source port: 54160  Destination port: iua

Frame 8: 59 bytes on wire (472 bits), 59 bytes captured (472 bits)
Ethernet II, Src: HonHaiPr_4c:c2:96 (00:23:4d:4c:c2:96), Dst: Netgear_c3:10:10 (00:1f:33:c3:10:10)
Internet Protocol Version 4, Src: 192.168.1.105 (192.168.1.105), Dst: 172.168.10.1 (172.168.10.1)
User Datagram Protocol, Src Port: 54160 (54160), Dst Port: iua (9900)
Data (17 bytes)

0000  6b 65 65 70 20 61 6c 69 76 65 20 70 61 63 6b 65   keep alive packe
0010  74                                                t

No.     Time        Source                Destination           Protocol Length Info
      9 2.744617    192.168.1.102         192.168.1.105         NBSS     60     Session keep-alive

Frame 9: 60 bytes on wire (480 bits), 60 bytes captured (480 bits)
Ethernet II, Src: WesternD_70:4e:56 (00:90:a9:70:4e:56), Dst: HonHaiPr_4c:c2:96 (00:23:4d:4c:c2:96)
Internet Protocol Version 4, Src: 192.168.1.102 (192.168.1.102), Dst: 192.168.1.105 (192.168.1.105)
Transmission Control Protocol, Src Port: microsoft-ds (445), Dst Port: activesync (1034), Seq: 1, Ack: 1, Len: 4
NetBIOS Session Service

No.     Time        Source                Destination           Protocol Length Info
     10 2.837362    fe80::a41e:7629:18a9:839 ff02::c               SSDP     208    M-SEARCH * HTTP/1.1 

Frame 10: 208 bytes on wire (1664 bits), 208 bytes captured (1664 bits)
Ethernet II, Src: HonHaiPr_4c:c2:96 (00:23:4d:4c:c2:96), Dst: IPv6mcast_00:00:00:0c (33:33:00:00:00:0c)
Internet Protocol Version 6, Src: fe80::a41e:7629:18a9:839 (fe80::a41e:7629:18a9:839), Dst: ff02::c (ff02::c)
User Datagram Protocol, Src Port: 65487 (65487), Dst Port: ssdp (1900)
Hypertext Transfer Protocol

No.     Time        Source                Destination           Protocol Length Info
     11 2.868044    HonHaiPr_4c:c2:96     Broadcast             ARP      42     Who has 192.168.1.1?  Tell 192.168.1.105

Frame 11: 42 bytes on wire (336 bits), 42 bytes captured (336 bits)
Ethernet II, Src: HonHaiPr_4c:c2:96 (00:23:4d:4c:c2:96), Dst: Broadcast (ff:ff:ff:ff:ff:ff)
Address Resolution Protocol (request)

No.     Time        Source                Destination           Protocol Length Info
     12 2.868979    Netgear_c3:10:10      HonHaiPr_4c:c2:96     ARP      42     192.168.1.1 is at 00:1f:33:c3:10:10

Frame 12: 42 bytes on wire (336 bits), 42 bytes captured (336 bits)
Ethernet II, Src: Netgear_c3:10:10 (00:1f:33:c3:10:10), Dst: HonHaiPr_4c:c2:96 (00:23:4d:4c:c2:96)
Address Resolution Protocol (reply)

No.     Time        Source                Destination           Protocol Length Info
     13 2.946299    192.168.1.105         192.168.1.102         TCP      54     activesync > microsoft-ds [ACK] Seq=1 Ack=5 Win=14840 Len=0

Frame 13: 54 bytes on wire (432 bits), 54 bytes captured (432 bits)
Ethernet II, Src: HonHaiPr_4c:c2:96 (00:23:4d:4c:c2:96), Dst: WesternD_70:4e:56 (00:90:a9:70:4e:56)
Internet Protocol Version 4, Src: 192.168.1.105 (192.168.1.105), Dst: 192.168.1.102 (192.168.1.102)
Transmission Control Protocol, Src Port: activesync (1034), Dst Port: microsoft-ds (445), Seq: 1, Ack: 5, Len: 0

No.     Time        Source                Destination           Protocol Length Info
     14 3.106783    192.168.1.105         172.168.10.1          UDP      59     Source port: 54160  Destination port: iua

Frame 14: 59 bytes on wire (472 bits), 59 bytes captured (472 bits)
Ethernet II, Src: HonHaiPr_4c:c2:96 (00:23:4d:4c:c2:96), Dst: Netgear_c3:10:10 (00:1f:33:c3:10:10)
Internet Protocol Version 4, Src: 192.168.1.105 (192.168.1.105), Dst: 172.168.10.1 (172.168.10.1)
User Datagram Protocol, Src Port: 54160 (54160), Dst Port: iua (9900)
Data (17 bytes)

0000  6b 65 65 70 20 61 6c 69 76 65 20 70 61 63 6b 65   keep alive packe
0010  74                                                t

No.     Time        Source                Destination           Protocol Length Info
     15 3.184888    192.168.1.105         239.255.255.250       SSDP     175    M-SEARCH * HTTP/1.1 

Frame 15: 175 bytes on wire (1400 bits), 175 bytes captured (1400 bits)
Ethernet II, Src: HonHaiPr_4c:c2:96 (00:23:4d:4c:c2:96), Dst: IPv4mcast_7f:ff:fa (01:00:5e:7f:ff:fa)
Internet Protocol Version 4, Src: 192.168.1.105 (192.168.1.105), Dst: 239.255.255.250 (239.255.255.250)
User Datagram Protocol, Src Port: 65489 (65489), Dst Port: ssdp (1900)
Hypertext Transfer Protocol

No.     Time        Source                Destination           Protocol Length Info
     16 3.626849    192.168.1.105         172.168.10.1          UDP      59     Source port: 54160  Destination port: iua

Frame 16: 59 bytes on wire (472 bits), 59 bytes captured (472 bits)
Ethernet II, Src: HonHaiPr_4c:c2:96 (00:23:4d:4c:c2:96), Dst: Netgear_c3:10:10 (00:1f:33:c3:10:10)
Internet Protocol Version 4, Src: 192.168.1.105 (192.168.1.105), Dst: 172.168.10.1 (172.168.10.1)
User Datagram Protocol, Src Port: 54160 (54160), Dst Port: iua (9900)
Data (17 bytes)

0000  6b 65 65 70 20 61 6c 69 76 65 20 70 61 63 6b 65   keep alive packe
0010  74                                                t

No.     Time        Source                Destination           Protocol Length Info
     17 4.049752    Netgear_c3:10:10      Broadcast             ARP      42     Who has 192.168.1.103?  Tell 192.168.1.1

Frame 17: 42 bytes on wire (336 bits), 42 bytes captured (336 bits)
Ethernet II, Src: Netgear_c3:10:10 (00:1f:33:c3:10:10), Dst: Broadcast (ff:ff:ff:ff:ff:ff)
Address Resolution Protocol (request)

No.     Time        Source                Destination           Protocol Length Info
     18 4.146490    192.168.1.105         172.168.10.1          UDP      59     Source port: 54160  Destination port: iua

Frame 18: 59 bytes on wire (472 bits), 59 bytes captured (472 bits)
Ethernet II, Src: HonHaiPr_4c:c2:96 (00:23:4d:4c:c2:96), Dst: Netgear_c3:10:10 (00:1f:33:c3:10:10)
Internet Protocol Version 4, Src: 192.168.1.105 (192.168.1.105), Dst: 172.168.10.1 (172.168.10.1)
User Datagram Protocol, Src Port: 54160 (54160), Dst Port: iua (9900)
Data (17 bytes)

0000  6b 65 65 70 20 61 6c 69 76 65 20 70 61 63 6b 65   keep alive packe
0010  74                                                t

No.     Time        Source                Destination           Protocol Length Info
     19 4.656624    192.168.1.105         172.168.10.1          UDP      59     Source port: 54160  Destination port: iua

Frame 19: 59 bytes on wire (472 bits), 59 bytes captured (472 bits)
Ethernet II, Src: HonHaiPr_4c:c2:96 (00:23:4d:4c:c2:96), Dst: Netgear_c3:10:10 (00:1f:33:c3:10:10)
Internet Protocol Version 4, Src: 192.168.1.105 (192.168.1.105), Dst: 172.168.10.1 (172.168.10.1)
User Datagram Protocol, Src Port: 54160 (54160), Dst Port: iua (9900)
Data (17 bytes)

0000  6b 65 65 70 20 61 6c 69 76 65 20 70 61 63 6b 65   keep alive packe
0010  74                                                t

No.     Time        Source                Destination           Protocol Length Info
     20 4.971322    Netgear_c3:10:10      Broadcast             ARP      42     Who has 192.168.1.103?  Tell 192.168.1.1

Frame 20: 42 bytes on wire (336 bits), 42 bytes captured (336 bits)
Ethernet II, Src: Netgear_c3:10:10 (00:1f:33:c3:10:10), Dst: Broadcast (ff:ff:ff:ff:ff:ff)
Address Resolution Protocol (request)

No.     Time        Source                Destination           Protocol Length Info
     21 5.176944    192.168.1.105         172.168.10.1          UDP      59     Source port: 54160  Destination port: iua

Frame 21: 59 bytes on wire (472 bits), 59 bytes captured (472 bits)
Ethernet II, Src: HonHaiPr_4c:c2:96 (00:23:4d:4c:c2:96), Dst: Netgear_c3:10:10 (00:1f:33:c3:10:10)
Internet Protocol Version 4, Src: 192.168.1.105 (192.168.1.105), Dst: 172.168.10.1 (172.168.10.1)
User Datagram Protocol, Src Port: 54160 (54160), Dst Port: iua (9900)
Data (17 bytes)

0000  6b 65 65 70 20 61 6c 69 76 65 20 70 61 63 6b 65   keep alive packe
0010  74                                                t

No.     Time        Source                Destination           Protocol Length Info
     22 5.686368    192.168.1.105         172.168.10.1          UDP      59     Source port: 54160  Destination port: iua

Frame 22: 59 bytes on wire (472 bits), 59 bytes captured (472 bits)
Ethernet II, Src: HonHaiPr_4c:c2:96 (00:23:4d:4c:c2:96), Dst: Netgear_c3:10:10 (00:1f:33:c3:10:10)
Internet Protocol Version 4, Src: 192.168.1.105 (192.168.1.105), Dst: 172.168.10.1 (172.168.10.1)
User Datagram Protocol, Src Port: 54160 (54160), Dst Port: iua (9900)
Data (17 bytes)

0000  6b 65 65 70 20 61 6c 69 76 65 20 70 61 63 6b 65   keep alive packe
0010  74                                                t

No.     Time        Source                Destination           Protocol Length Info
     23 5.836612    fe80::a41e:7629:18a9:839 ff02::c               SSDP     208    M-SEARCH * HTTP/1.1 

Frame 23: 208 bytes on wire (1664 bits), 208 bytes captured (1664 bits)
Ethernet II, Src: HonHaiPr_4c:c2:96 (00:23:4d:4c:c2:96), Dst: IPv6mcast_00:00:00:0c (33:33:00:00:00:0c)
Internet Protocol Version 6, Src: fe80::a41e:7629:18a9:839 (fe80::a41e:7629:18a9:839), Dst: ff02::c (ff02::c)
User Datagram Protocol, Src Port: 65487 (65487), Dst Port: ssdp (1900)
Hypertext Transfer Protocol

No.     Time        Source                Destination           Protocol Length Info
     24 6.013121    192.168.1.105         202.172.28.103        TCP      66     infoexch > http [SYN] Seq=0 Win=8192 Len=0 MSS=1460 WS=4 SACK_PERM=1

Frame 24: 66 bytes on wire (528 bits), 66 bytes captured (528 bits)
Ethernet II, Src: HonHaiPr_4c:c2:96 (00:23:4d:4c:c2:96), Dst: Netgear_c3:10:10 (00:1f:33:c3:10:10)
Internet Protocol Version 4, Src: 192.168.1.105 (192.168.1.105), Dst: 202.172.28.103 (202.172.28.103)
Transmission Control Protocol, Src Port: infoexch (3667), Dst Port: http (80), Seq: 0, Len: 0

No.     Time        Source                Destination           Protocol Length Info
     25 6.177461    192.168.1.105         239.255.255.250       SSDP     175    M-SEARCH * HTTP/1.1 

Frame 25: 175 bytes on wire (1400 bits), 175 bytes captured (1400 bits)
Ethernet II, Src: HonHaiPr_4c:c2:96 (00:23:4d:4c:c2:96), Dst: IPv4mcast_7f:ff:fa (01:00:5e:7f:ff:fa)
Internet Protocol Version 4, Src: 192.168.1.105 (192.168.1.105), Dst: 239.255.255.250 (239.255.255.250)
User Datagram Protocol, Src Port: 65489 (65489), Dst Port: ssdp (1900)
Hypertext Transfer Protocol

No.     Time        Source                Destination           Protocol Length Info
     26 6.196099    202.172.28.103        192.168.1.105         TCP      66     http > infoexch [SYN, ACK] Seq=0 Ack=1 Win=5840 Len=0 MSS=1460 SACK_PERM=1 WS=128

Frame 26: 66 bytes on wire (528 bits), 66 bytes captured (528 bits)
Ethernet II, Src: Netgear_c3:10:10 (00:1f:33:c3:10:10), Dst: HonHaiPr_4c:c2:96 (00:23:4d:4c:c2:96)
Internet Protocol Version 4, Src: 202.172.28.103 (202.172.28.103), Dst: 192.168.1.105 (192.168.1.105)
Transmission Control Protocol, Src Port: http (80), Dst Port: infoexch (3667), Seq: 0, Ack: 1, Len: 0

No.     Time        Source                Destination           Protocol Length Info
     27 6.196252    192.168.1.105         202.172.28.103        TCP      54     infoexch > http [ACK] Seq=1 Ack=1 Win=17520 Len=0

Frame 27: 54 bytes on wire (432 bits), 54 bytes captured (432 bits)
Ethernet II, Src: HonHaiPr_4c:c2:96 (00:23:4d:4c:c2:96), Dst: Netgear_c3:10:10 (00:1f:33:c3:10:10)
Internet Protocol Version 4, Src: 192.168.1.105 (192.168.1.105), Dst: 202.172.28.103 (202.172.28.103)
Transmission Control Protocol, Src Port: infoexch (3667), Dst Port: http (80), Seq: 1, Ack: 1, Len: 0

No.     Time        Source                Destination           Protocol Length Info
     28 6.200070    Netgear_c3:10:10      Broadcast             ARP      42     Who has 192.168.1.103?  Tell 192.168.1.1

Frame 28: 42 bytes on wire (336 bits), 42 bytes captured (336 bits)
Ethernet II, Src: Netgear_c3:10:10 (00:1f:33:c3:10:10), Dst: Broadcast (ff:ff:ff:ff:ff:ff)
Address Resolution Protocol (request)

No.     Time        Source                Destination           Protocol Length Info
     29 6.201081    192.168.1.105         202.172.28.103        TCP      1514   [TCP segment of a reassembled PDU]

Frame 29: 1514 bytes on wire (12112 bits), 1514 bytes captured (12112 bits)
Ethernet II, Src: HonHaiPr_4c:c2:96 (00:23:4d:4c:c2:96), Dst: Netgear_c3:10:10 (00:1f:33:c3:10:10)
Internet Protocol Version 4, Src: 192.168.1.105 (192.168.1.105), Dst: 202.172.28.103 (202.172.28.103)
Transmission Control Protocol, Src Port: infoexch (3667), Dst Port: http (80), Seq: 1, Ack: 1, Len: 1460

No.     Time        Source                Destination           Protocol Length Info
     30 6.201099    192.168.1.105         202.172.28.103        HTTP     195    GET /?t=www&u=%2Fwatch%2F1325764778 HTTP/1.1 

Frame 30: 195 bytes on wire (1560 bits), 195 bytes captured (1560 bits)
Ethernet II, Src: HonHaiPr_4c:c2:96 (00:23:4d:4c:c2:96), Dst: Netgear_c3:10:10 (00:1f:33:c3:10:10)
Internet Protocol Version 4, Src: 192.168.1.105 (192.168.1.105), Dst: 202.172.28.103 (202.172.28.103)
Transmission Control Protocol, Src Port: infoexch (3667), Dst Port: http (80), Seq: 1461, Ack: 1, Len: 141
[2 Reassembled TCP Segments (1601 bytes): #29(1460), #30(141)]
Hypertext Transfer Protocol

No.     Time        Source                Destination           Protocol Length Info
     31 6.206437    192.168.1.105         172.168.10.1          UDP      59     Source port: 54160  Destination port: iua

Frame 31: 59 bytes on wire (472 bits), 59 bytes captured (472 bits)
Ethernet II, Src: HonHaiPr_4c:c2:96 (00:23:4d:4c:c2:96), Dst: Netgear_c3:10:10 (00:1f:33:c3:10:10)
Internet Protocol Version 4, Src: 192.168.1.105 (192.168.1.105), Dst: 172.168.10.1 (172.168.10.1)
User Datagram Protocol, Src Port: 54160 (54160), Dst Port: iua (9900)
Data (17 bytes)

0000  6b 65 65 70 20 61 6c 69 76 65 20 70 61 63 6b 65   keep alive packe
0010  74                                                t

No.     Time        Source                Destination           Protocol Length Info
     32 6.382464    202.172.28.103        192.168.1.105         TCP      54     http > infoexch [ACK] Seq=1 Ack=1461 Win=8832 Len=0

Frame 32: 54 bytes on wire (432 bits), 54 bytes captured (432 bits)
Ethernet II, Src: Netgear_c3:10:10 (00:1f:33:c3:10:10), Dst: HonHaiPr_4c:c2:96 (00:23:4d:4c:c2:96)
Internet Protocol Version 4, Src: 202.172.28.103 (202.172.28.103), Dst: 192.168.1.105 (192.168.1.105)
Transmission Control Protocol, Src Port: http (80), Dst Port: infoexch (3667), Seq: 1, Ack: 1461, Len: 0

No.     Time        Source                Destination           Protocol Length Info
     33 6.382571    202.172.28.103        192.168.1.105         TCP      54     http > infoexch [ACK] Seq=1 Ack=1602 Win=11776 Len=0

Frame 33: 54 bytes on wire (432 bits), 54 bytes captured (432 bits)
Ethernet II, Src: Netgear_c3:10:10 (00:1f:33:c3:10:10), Dst: HonHaiPr_4c:c2:96 (00:23:4d:4c:c2:96)
Internet Protocol Version 4, Src: 202.172.28.103 (202.172.28.103), Dst: 192.168.1.105 (192.168.1.105)
Transmission Control Protocol, Src Port: http (80), Dst Port: infoexch (3667), Seq: 1, Ack: 1602, Len: 0

No.     Time        Source                Destination           Protocol Length Info
     34 6.494425    202.172.28.103        192.168.1.105         TCP      1514   [TCP segment of a reassembled PDU]

Frame 34: 1514 bytes on wire (12112 bits), 1514 bytes captured (12112 bits)
Ethernet II, Src: Netgear_c3:10:10 (00:1f:33:c3:10:10), Dst: HonHaiPr_4c:c2:96 (00:23:4d:4c:c2:96)
Internet Protocol Version 4, Src: 202.172.28.103 (202.172.28.103), Dst: 192.168.1.105 (192.168.1.105)
Transmission Control Protocol, Src Port: http (80), Dst Port: infoexch (3667), Seq: 1, Ack: 1602, Len: 1460

No.     Time        Source                Destination           Protocol Length Info
     35 6.495481    202.172.28.103        192.168.1.105         TCP      1514   [TCP segment of a reassembled PDU]

Frame 35: 1514 bytes on wire (12112 bits), 1514 bytes captured (12112 bits)
Ethernet II, Src: Netgear_c3:10:10 (00:1f:33:c3:10:10), Dst: HonHaiPr_4c:c2:96 (00:23:4d:4c:c2:96)
Internet Protocol Version 4, Src: 202.172.28.103 (202.172.28.103), Dst: 192.168.1.105 (192.168.1.105)
Transmission Control Protocol, Src Port: http (80), Dst Port: infoexch (3667), Seq: 1461, Ack: 1602, Len: 1460

No.     Time        Source                Destination           Protocol Length Info
     36 6.495544    192.168.1.105         202.172.28.103        TCP      54     infoexch > http [ACK] Seq=1602 Ack=2921 Win=17520 Len=0

Frame 36: 54 bytes on wire (432 bits), 54 bytes captured (432 bits)
Ethernet II, Src: HonHaiPr_4c:c2:96 (00:23:4d:4c:c2:96), Dst: Netgear_c3:10:10 (00:1f:33:c3:10:10)
Internet Protocol Version 4, Src: 192.168.1.105 (192.168.1.105), Dst: 202.172.28.103 (202.172.28.103)
Transmission Control Protocol, Src Port: infoexch (3667), Dst Port: http (80), Seq: 1602, Ack: 2921, Len: 0

No.     Time        Source                Destination           Protocol Length Info
     37 6.576360    192.168.1.105         202.248.110.223       TCP      66     dell-rm-port > http [SYN] Seq=0 Win=8192 Len=0 MSS=1460 WS=4 SACK_PERM=1

Frame 37: 66 bytes on wire (528 bits), 66 bytes captured (528 bits)
Ethernet II, Src: HonHaiPr_4c:c2:96 (00:23:4d:4c:c2:96), Dst: Netgear_c3:10:10 (00:1f:33:c3:10:10)
Internet Protocol Version 4, Src: 192.168.1.105 (192.168.1.105), Dst: 202.248.110.223 (202.248.110.223)
Transmission Control Protocol, Src Port: dell-rm-port (3668), Dst Port: http (80), Seq: 0, Len: 0

No.     Time        Source                Destination           Protocol Length Info
     38 6.677207    202.172.28.103        192.168.1.105         TCP      1514   [TCP segment of a reassembled PDU]

Frame 38: 1514 bytes on wire (12112 bits), 1514 bytes captured (12112 bits)
Ethernet II, Src: Netgear_c3:10:10 (00:1f:33:c3:10:10), Dst: HonHaiPr_4c:c2:96 (00:23:4d:4c:c2:96)
Internet Protocol Version 4, Src: 202.172.28.103 (202.172.28.103), Dst: 192.168.1.105 (192.168.1.105)
Transmission Control Protocol, Src Port: http (80), Dst Port: infoexch (3667), Seq: 2921, Ack: 1602, Len: 1460

No.     Time        Source                Destination           Protocol Length Info
     39 6.677418    202.172.28.103        192.168.1.105         TCP      1514   [TCP segment of a reassembled PDU]

Frame 39: 1514 bytes on wire (12112 bits), 1514 bytes captured (12112 bits)
Ethernet II, Src: Netgear_c3:10:10 (00:1f:33:c3:10:10), Dst: HonHaiPr_4c:c2:96 (00:23:4d:4c:c2:96)
Internet Protocol Version 4, Src: 202.172.28.103 (202.172.28.103), Dst: 192.168.1.105 (192.168.1.105)
Transmission Control Protocol, Src Port: http (80), Dst Port: infoexch (3667), Seq: 4381, Ack: 1602, Len: 1460

No.     Time        Source                Destination           Protocol Length Info
     40 6.677478    192.168.1.105         202.172.28.103        TCP      54     infoexch > http [ACK] Seq=1602 Ack=5841 Win=17520 Len=0

Frame 40: 54 bytes on wire (432 bits), 54 bytes captured (432 bits)
Ethernet II, Src: HonHaiPr_4c:c2:96 (00:23:4d:4c:c2:96), Dst: Netgear_c3:10:10 (00:1f:33:c3:10:10)
Internet Protocol Version 4, Src: 192.168.1.105 (192.168.1.105), Dst: 202.172.28.103 (202.172.28.103)
Transmission Control Protocol, Src Port: infoexch (3667), Dst Port: http (80), Seq: 1602, Ack: 5841, Len: 0

No.     Time        Source                Destination           Protocol Length Info
     41 6.677950    202.172.28.103        192.168.1.105         TCP      1514   [TCP segment of a reassembled PDU]

Frame 41: 1514 bytes on wire (12112 bits), 1514 bytes captured (12112 bits)
Ethernet II, Src: Netgear_c3:10:10 (00:1f:33:c3:10:10), Dst: HonHaiPr_4c:c2:96 (00:23:4d:4c:c2:96)
Internet Protocol Version 4, Src: 202.172.28.103 (202.172.28.103), Dst: 192.168.1.105 (192.168.1.105)
Transmission Control Protocol, Src Port: http (80), Dst Port: infoexch (3667), Seq: 5841, Ack: 1602, Len: 1460

No.     Time        Source                Destination           Protocol Length Info
     42 6.695672    192.168.1.105         202.172.28.103        TCP      66     casanswmgmt > http [SYN] Seq=0 Win=8192 Len=0 MSS=1460 WS=4 SACK_PERM=1

Frame 42: 66 bytes on wire (528 bits), 66 bytes captured (528 bits)
Ethernet II, Src: HonHaiPr_4c:c2:96 (00:23:4d:4c:c2:96), Dst: Netgear_c3:10:10 (00:1f:33:c3:10:10)
Internet Protocol Version 4, Src: 192.168.1.105 (192.168.1.105), Dst: 202.172.28.103 (202.172.28.103)
Transmission Control Protocol, Src Port: casanswmgmt (3669), Dst Port: http (80), Seq: 0, Len: 0

No.     Time        Source                Destination           Protocol Length Info
     43 6.696561    192.168.1.105         210.154.102.110       TCP      66     smile > http [SYN] Seq=0 Win=8192 Len=0 MSS=1460 WS=4 SACK_PERM=1

Frame 43: 66 bytes on wire (528 bits), 66 bytes captured (528 bits)
Ethernet II, Src: HonHaiPr_4c:c2:96 (00:23:4d:4c:c2:96), Dst: Netgear_c3:10:10 (00:1f:33:c3:10:10)
Internet Protocol Version 4, Src: 192.168.1.105 (192.168.1.105), Dst: 210.154.102.110 (210.154.102.110)
Transmission Control Protocol, Src Port: smile (3670), Dst Port: http (80), Seq: 0, Len: 0

No.     Time        Source                Destination           Protocol Length Info
     44 6.698289    192.168.1.105         210.154.102.110       TCP      66     efcp > http [SYN] Seq=0 Win=8192 Len=0 MSS=1460 WS=4 SACK_PERM=1

Frame 44: 66 bytes on wire (528 bits), 66 bytes captured (528 bits)
Ethernet II, Src: HonHaiPr_4c:c2:96 (00:23:4d:4c:c2:96), Dst: Netgear_c3:10:10 (00:1f:33:c3:10:10)
Internet Protocol Version 4, Src: 192.168.1.105 (192.168.1.105), Dst: 210.154.102.110 (210.154.102.110)
Transmission Control Protocol, Src Port: efcp (3671), Dst Port: http (80), Seq: 0, Len: 0

No.     Time        Source                Destination           Protocol Length Info
     45 6.712502    192.168.1.105         172.168.10.1          UDP      59     Source port: 54160  Destination port: iua

Frame 45: 59 bytes on wire (472 bits), 59 bytes captured (472 bits)
Ethernet II, Src: HonHaiPr_4c:c2:96 (00:23:4d:4c:c2:96), Dst: Netgear_c3:10:10 (00:1f:33:c3:10:10)
Internet Protocol Version 4, Src: 192.168.1.105 (192.168.1.105), Dst: 172.168.10.1 (172.168.10.1)
User Datagram Protocol, Src Port: 54160 (54160), Dst Port: iua (9900)
Data (17 bytes)

0000  6b 65 65 70 20 61 6c 69 76 65 20 70 61 63 6b 65   keep alive packe
0010  74                                                t

No.     Time        Source                Destination           Protocol Length Info
     46 6.761428    202.248.110.223       192.168.1.105         TCP      66     http > dell-rm-port [SYN, ACK] Seq=0 Ack=1 Win=4380 Len=0 MSS=1460 WS=1 SACK_PERM=1

Frame 46: 66 bytes on wire (528 bits), 66 bytes captured (528 bits)
Ethernet II, Src: Netgear_c3:10:10 (00:1f:33:c3:10:10), Dst: HonHaiPr_4c:c2:96 (00:23:4d:4c:c2:96)
Internet Protocol Version 4, Src: 202.248.110.223 (202.248.110.223), Dst: 192.168.1.105 (192.168.1.105)
Transmission Control Protocol, Src Port: http (80), Dst Port: dell-rm-port (3668), Seq: 0, Ack: 1, Len: 0

No.     Time        Source                Destination           Protocol Length Info
     47 6.761596    192.168.1.105         202.248.110.223       TCP      54     dell-rm-port > http [ACK] Seq=1 Ack=1 Win=17520 Len=0

Frame 47: 54 bytes on wire (432 bits), 54 bytes captured (432 bits)
Ethernet II, Src: HonHaiPr_4c:c2:96 (00:23:4d:4c:c2:96), Dst: Netgear_c3:10:10 (00:1f:33:c3:10:10)
Internet Protocol Version 4, Src: 192.168.1.105 (192.168.1.105), Dst: 202.248.110.223 (202.248.110.223)
Transmission Control Protocol, Src Port: dell-rm-port (3668), Dst Port: http (80), Seq: 1, Ack: 1, Len: 0

No.     Time        Source                Destination           Protocol Length Info
     48 6.763562    192.168.1.105         202.248.110.223       HTTP     1514   Continuation or non-HTTP traffic

Frame 48: 1514 bytes on wire (12112 bits), 1514 bytes captured (12112 bits)
Ethernet II, Src: HonHaiPr_4c:c2:96 (00:23:4d:4c:c2:96), Dst: Netgear_c3:10:10 (00:1f:33:c3:10:10)
Internet Protocol Version 4, Src: 192.168.1.105 (192.168.1.105), Dst: 202.248.110.223 (202.248.110.223)
Transmission Control Protocol, Src Port: dell-rm-port (3668), Dst Port: http (80), Seq: 1, Ack: 1, Len: 1460
Hypertext Transfer Protocol

No.     Time        Source                Destination           Protocol Length Info
     49 6.763580    192.168.1.105         202.248.110.223       HTTP     487    Continuation or non-HTTP traffic

Frame 49: 487 bytes on wire (3896 bits), 487 bytes captured (3896 bits)
Ethernet II, Src: HonHaiPr_4c:c2:96 (00:23:4d:4c:c2:96), Dst: Netgear_c3:10:10 (00:1f:33:c3:10:10)
Internet Protocol Version 4, Src: 192.168.1.105 (192.168.1.105), Dst: 202.248.110.223 (202.248.110.223)
Transmission Control Protocol, Src Port: dell-rm-port (3668), Dst Port: http (80), Seq: 1461, Ack: 1, Len: 433
Hypertext Transfer Protocol

No.     Time        Source                Destination           Protocol Length Info
     50 6.813155    192.168.1.105         74.125.227.90         TCP      66     lispworks-orb > http [SYN] Seq=0 Win=8192 Len=0 MSS=1460 WS=4 SACK_PERM=1

Frame 50: 66 bytes on wire (528 bits), 66 bytes captured (528 bits)
Ethernet II, Src: HonHaiPr_4c:c2:96 (00:23:4d:4c:c2:96), Dst: Netgear_c3:10:10 (00:1f:33:c3:10:10)
Internet Protocol Version 4, Src: 192.168.1.105 (192.168.1.105), Dst: 74.125.227.90 (74.125.227.90)
Transmission Control Protocol, Src Port: lispworks-orb (3672), Dst Port: http (80), Seq: 0, Len: 0

No.     Time        Source                Destination           Protocol Length Info
     51 6.833363    74.125.227.90         192.168.1.105         TCP      66     http > lispworks-orb [SYN, ACK] Seq=0 Ack=1 Win=5720 Len=0 MSS=1430 SACK_PERM=1 WS=64

Frame 51: 66 bytes on wire (528 bits), 66 bytes captured (528 bits)
Ethernet II, Src: Netgear_c3:10:10 (00:1f:33:c3:10:10), Dst: HonHaiPr_4c:c2:96 (00:23:4d:4c:c2:96)
Internet Protocol Version 4, Src: 74.125.227.90 (74.125.227.90), Dst: 192.168.1.105 (192.168.1.105)
Transmission Control Protocol, Src Port: http (80), Dst Port: lispworks-orb (3672), Seq: 0, Ack: 1, Len: 0

No.     Time        Source                Destination           Protocol Length Info
     52 6.833441    192.168.1.105         74.125.227.90         TCP      54     lispworks-orb > http [ACK] Seq=1 Ack=1 Win=17160 Len=0

Frame 52: 54 bytes on wire (432 bits), 54 bytes captured (432 bits)
Ethernet II, Src: HonHaiPr_4c:c2:96 (00:23:4d:4c:c2:96), Dst: Netgear_c3:10:10 (00:1f:33:c3:10:10)
Internet Protocol Version 4, Src: 192.168.1.105 (192.168.1.105), Dst: 74.125.227.90 (74.125.227.90)
Transmission Control Protocol, Src Port: lispworks-orb (3672), Dst Port: http (80), Seq: 1, Ack: 1, Len: 0

No.     Time        Source                Destination           Protocol Length Info
     53 6.833834    192.168.1.105         74.125.227.90         HTTP     1206   GET /gampad/ads?correlator=21&output=json_html&callback=GA_googleSetAdContentsBySlotForSync&impl=s&client=ca-pub-1828667301391598&slotname=channelwatch_468x60&page_slots=channelwatch_468x60&cookie=ID%3De53131a2bc426adf%3AT%3D1328127026%3AS%3DALNI_MaxY54HypvznJIJsPSNJXUCLI-8Fg&url=http%3A%2F%2Fwww.nicovideo.jp%2Fwatch%2F1325764778&ref=http%3A%2F%2Fch.nicovideo.jp%2Fvideo%2Fmilky-holmes2&lmt=1330665686&dt=1330665686885&cc=100&oe=utf-8&biw=1421&bih=653&adk=1407840414&adx=0&ady=0&ifi=1&oid=3&u_tz=-360&u_java=true&u_h=900&u_w=1440&u_ah=900&u_aw=1440&u_cd=32&flash=11.0.1.152&gads=v2&ga_vid=80831070.1328210705&ga_sid=1330665562&ga_hid=133703458&ga_fc=true HTTP/1.1 

Frame 53: 1206 bytes on wire (9648 bits), 1206 bytes captured (9648 bits)
Ethernet II, Src: HonHaiPr_4c:c2:96 (00:23:4d:4c:c2:96), Dst: Netgear_c3:10:10 (00:1f:33:c3:10:10)
Internet Protocol Version 4, Src: 192.168.1.105 (192.168.1.105), Dst: 74.125.227.90 (74.125.227.90)
Transmission Control Protocol, Src Port: lispworks-orb (3672), Dst Port: http (80), Seq: 1, Ack: 1, Len: 1152
Hypertext Transfer Protocol

No.     Time        Source                Destination           Protocol Length Info
     54 6.856888    202.172.28.103        192.168.1.105         TCP      1514   [TCP segment of a reassembled PDU]

Frame 54: 1514 bytes on wire (12112 bits), 1514 bytes captured (12112 bits)
Ethernet II, Src: Netgear_c3:10:10 (00:1f:33:c3:10:10), Dst: HonHaiPr_4c:c2:96 (00:23:4d:4c:c2:96)
Internet Protocol Version 4, Src: 202.172.28.103 (202.172.28.103), Dst: 192.168.1.105 (192.168.1.105)
Transmission Control Protocol, Src Port: http (80), Dst Port: infoexch (3667), Seq: 7301, Ack: 1602, Len: 1460

No.     Time        Source                Destination           Protocol Length Info
     55 6.856961    192.168.1.105         202.172.28.103        TCP      54     infoexch > http [ACK] Seq=1602 Ack=8761 Win=17520 Len=0

Frame 55: 54 bytes on wire (432 bits), 54 bytes captured (432 bits)
Ethernet II, Src: HonHaiPr_4c:c2:96 (00:23:4d:4c:c2:96), Dst: Netgear_c3:10:10 (00:1f:33:c3:10:10)
Internet Protocol Version 4, Src: 192.168.1.105 (192.168.1.105), Dst: 202.172.28.103 (202.172.28.103)
Transmission Control Protocol, Src Port: infoexch (3667), Dst Port: http (80), Seq: 1602, Ack: 8761, Len: 0

No.     Time        Source                Destination           Protocol Length Info
     56 6.859923    202.172.28.103        192.168.1.105         TCP      1514   [TCP segment of a reassembled PDU]

Frame 56: 1514 bytes on wire (12112 bits), 1514 bytes captured (12112 bits)
Ethernet II, Src: Netgear_c3:10:10 (00:1f:33:c3:10:10), Dst: HonHaiPr_4c:c2:96 (00:23:4d:4c:c2:96)
Internet Protocol Version 4, Src: 202.172.28.103 (202.172.28.103), Dst: 192.168.1.105 (192.168.1.105)
Transmission Control Protocol, Src Port: http (80), Dst Port: infoexch (3667), Seq: 8761, Ack: 1602, Len: 1460

No.     Time        Source                Destination           Protocol Length Info
     57 6.863766    74.125.227.90         192.168.1.105         TCP      54     http > lispworks-orb [ACK] Seq=1 Ack=1153 Win=8064 Len=0

Frame 57: 54 bytes on wire (432 bits), 54 bytes captured (432 bits)
Ethernet II, Src: Netgear_c3:10:10 (00:1f:33:c3:10:10), Dst: HonHaiPr_4c:c2:96 (00:23:4d:4c:c2:96)
Internet Protocol Version 4, Src: 74.125.227.90 (74.125.227.90), Dst: 192.168.1.105 (192.168.1.105)
Transmission Control Protocol, Src Port: http (80), Dst Port: lispworks-orb (3672), Seq: 1, Ack: 1153, Len: 0

No.     Time        Source                Destination           Protocol Length Info
     58 6.875452    202.172.28.103        192.168.1.105         TCP      66     http > casanswmgmt [SYN, ACK] Seq=0 Ack=1 Win=5840 Len=0 MSS=1460 SACK_PERM=1 WS=128

Frame 58: 66 bytes on wire (528 bits), 66 bytes captured (528 bits)
Ethernet II, Src: Netgear_c3:10:10 (00:1f:33:c3:10:10), Dst: HonHaiPr_4c:c2:96 (00:23:4d:4c:c2:96)
Internet Protocol Version 4, Src: 202.172.28.103 (202.172.28.103), Dst: 192.168.1.105 (192.168.1.105)
Transmission Control Protocol, Src Port: http (80), Dst Port: casanswmgmt (3669), Seq: 0, Ack: 1, Len: 0

No.     Time        Source                Destination           Protocol Length Info
     59 6.875546    192.168.1.105         202.172.28.103        TCP      54     casanswmgmt > http [ACK] Seq=1 Ack=1 Win=17520 Len=0

Frame 59: 54 bytes on wire (432 bits), 54 bytes captured (432 bits)
Ethernet II, Src: HonHaiPr_4c:c2:96 (00:23:4d:4c:c2:96), Dst: Netgear_c3:10:10 (00:1f:33:c3:10:10)
Internet Protocol Version 4, Src: 192.168.1.105 (192.168.1.105), Dst: 202.172.28.103 (202.172.28.103)
Transmission Control Protocol, Src Port: casanswmgmt (3669), Dst Port: http (80), Seq: 1, Ack: 1, Len: 0

No.     Time        Source                Destination           Protocol Length Info
     60 6.876113    192.168.1.105         202.172.28.103        TCP      1514   [TCP segment of a reassembled PDU]

Frame 60: 1514 bytes on wire (12112 bits), 1514 bytes captured (12112 bits)
Ethernet II, Src: HonHaiPr_4c:c2:96 (00:23:4d:4c:c2:96), Dst: Netgear_c3:10:10 (00:1f:33:c3:10:10)
Internet Protocol Version 4, Src: 192.168.1.105 (192.168.1.105), Dst: 202.172.28.103 (202.172.28.103)
Transmission Control Protocol, Src Port: casanswmgmt (3669), Dst Port: http (80), Seq: 1, Ack: 1, Len: 1460

No.     Time        Source                Destination           Protocol Length Info
     61 6.876122    192.168.1.105         202.172.28.103        HTTP     206    GET /?t=www&u=%2Fimg%2Fremocon%2Fremocon_off.gif HTTP/1.1 

Frame 61: 206 bytes on wire (1648 bits), 206 bytes captured (1648 bits)
Ethernet II, Src: HonHaiPr_4c:c2:96 (00:23:4d:4c:c2:96), Dst: Netgear_c3:10:10 (00:1f:33:c3:10:10)
Internet Protocol Version 4, Src: 192.168.1.105 (192.168.1.105), Dst: 202.172.28.103 (202.172.28.103)
Transmission Control Protocol, Src Port: casanswmgmt (3669), Dst Port: http (80), Seq: 1461, Ack: 1, Len: 152
[2 Reassembled TCP Segments (1612 bytes): #60(1460), #61(152)]
Hypertext Transfer Protocol

No.     Time        Source                Destination           Protocol Length Info
     62 6.886853    210.154.102.110       192.168.1.105         TCP      66     http > smile [SYN, ACK] Seq=0 Ack=1 Win=5840 Len=0 MSS=1460 SACK_PERM=1 WS=512

Frame 62: 66 bytes on wire (528 bits), 66 bytes captured (528 bits)
Ethernet II, Src: Netgear_c3:10:10 (00:1f:33:c3:10:10), Dst: HonHaiPr_4c:c2:96 (00:23:4d:4c:c2:96)
Internet Protocol Version 4, Src: 210.154.102.110 (210.154.102.110), Dst: 192.168.1.105 (192.168.1.105)
Transmission Control Protocol, Src Port: http (80), Dst Port: smile (3670), Seq: 0, Ack: 1, Len: 0

No.     Time        Source                Destination           Protocol Length Info
     63 6.886914    192.168.1.105         210.154.102.110       TCP      54     smile > http [ACK] Seq=1 Ack=1 Win=17520 Len=0

Frame 63: 54 bytes on wire (432 bits), 54 bytes captured (432 bits)
Ethernet II, Src: HonHaiPr_4c:c2:96 (00:23:4d:4c:c2:96), Dst: Netgear_c3:10:10 (00:1f:33:c3:10:10)
Internet Protocol Version 4, Src: 192.168.1.105 (192.168.1.105), Dst: 210.154.102.110 (210.154.102.110)
Transmission Control Protocol, Src Port: smile (3670), Dst Port: http (80), Seq: 1, Ack: 1, Len: 0

No.     Time        Source                Destination           Protocol Length Info
     64 6.887315    192.168.1.105         210.154.102.110       HTTP     477    GET /img/watch/tit_icon/commons.png HTTP/1.1 

Frame 64: 477 bytes on wire (3816 bits), 477 bytes captured (3816 bits)
Ethernet II, Src: HonHaiPr_4c:c2:96 (00:23:4d:4c:c2:96), Dst: Netgear_c3:10:10 (00:1f:33:c3:10:10)
Internet Protocol Version 4, Src: 192.168.1.105 (192.168.1.105), Dst: 210.154.102.110 (210.154.102.110)
Transmission Control Protocol, Src Port: smile (3670), Dst Port: http (80), Seq: 1, Ack: 1, Len: 423
Hypertext Transfer Protocol

No.     Time        Source                Destination           Protocol Length Info
     65 6.889087    74.125.227.90         192.168.1.105         TCP      1484   [TCP segment of a reassembled PDU]

Frame 65: 1484 bytes on wire (11872 bits), 1484 bytes captured (11872 bits)
Ethernet II, Src: Netgear_c3:10:10 (00:1f:33:c3:10:10), Dst: HonHaiPr_4c:c2:96 (00:23:4d:4c:c2:96)
Internet Protocol Version 4, Src: 74.125.227.90 (74.125.227.90), Dst: 192.168.1.105 (192.168.1.105)
Transmission Control Protocol, Src Port: http (80), Dst Port: lispworks-orb (3672), Seq: 1, Ack: 1153, Len: 1430

